[
 {
  "id": "gartner-hype-cycle-1995-001-dropped",
  "prior_claim_id": "gartner-hype-cycle-1995-001",
  "change": "dropped",
  "subject_id": "emergent-computation"
 },
 {
  "id": "gartner-hype-cycle-1995-002-dropped",
  "prior_claim_id": "gartner-hype-cycle-1995-002",
  "change": "dropped",
  "subject_id": "wireless-communications"
 },
 {
  "id": "gartner-hype-cycle-1995-003-dropped",
  "prior_claim_id": "gartner-hype-cycle-1995-003",
  "change": "dropped",
  "subject_id": "intelligent-agents"
 },
 {
  "id": "gartner-hype-cycle-1995-004-dropped",
  "prior_claim_id": "gartner-hype-cycle-1995-004",
  "change": "dropped",
  "subject_id": "information-superhighway"
 },
 {
  "id": "gartner-hype-cycle-1995-006-dropped",
  "prior_claim_id": "gartner-hype-cycle-1995-006",
  "change": "dropped",
  "subject_id": "video-conferencing"
 },
 {
  "id": "gartner-hype-cycle-1995-010-dropped",
  "prior_claim_id": "gartner-hype-cycle-1995-010",
  "change": "dropped",
  "subject_id": "knowledge-based-systems"
 },
 {
  "id": "gartner-hype-cycle-1996-002-renamed",
  "prior_claim_id": "gartner-hype-cycle-1996-002",
  "new_claim_id": "gartner-hype-cycle-1997-005",
  "change": "renamed",
  "subject_id": "dvd",
  "note": "\"Digital Video Disk\" -> \"DVD\""
 },
 {
  "id": "gartner-hype-cycle-1996-004-dropped",
  "prior_claim_id": "gartner-hype-cycle-1996-004",
  "change": "dropped",
  "subject_id": "intranets"
 },
 {
  "id": "gartner-hype-cycle-1996-005-dropped",
  "prior_claim_id": "gartner-hype-cycle-1996-005",
  "change": "dropped",
  "subject_id": "java"
 },
 {
  "id": "gartner-hype-cycle-1996-006-dropped",
  "prior_claim_id": "gartner-hype-cycle-1996-006",
  "change": "dropped",
  "subject_id": "internet-terminals"
 },
 {
  "id": "gartner-hype-cycle-1996-007-dropped",
  "prior_claim_id": "gartner-hype-cycle-1996-007",
  "change": "dropped",
  "subject_id": "world-wide-web"
 },
 {
  "id": "gartner-hype-cycle-1996-010-renamed",
  "prior_claim_id": "gartner-hype-cycle-1996-010",
  "new_claim_id": "gartner-hype-cycle-1997-012",
  "change": "renamed",
  "subject_id": "interactive-tv",
  "note": "\"Interactive TV\" -> \"Interactive/ Web TV\""
 },
 {
  "id": "gartner-hype-cycle-1996-011-renamed",
  "prior_claim_id": "gartner-hype-cycle-1996-011",
  "new_claim_id": "gartner-hype-cycle-1997-014",
  "change": "renamed",
  "subject_id": "personal-digital-assistants",
  "note": "\"Personal Digital Assistants\" -> \"PDAs\""
 },
 {
  "id": "gartner-hype-cycle-1996-012-dropped",
  "prior_claim_id": "gartner-hype-cycle-1996-012",
  "change": "dropped",
  "subject_id": "desktop-computer-telephony-integration"
 },
 {
  "id": "gartner-hype-cycle-1996-013-dropped",
  "prior_claim_id": "gartner-hype-cycle-1996-013",
  "change": "dropped",
  "subject_id": "handwriting-recognition"
 },
 {
  "id": "gartner-hype-cycle-1996-017-dropped",
  "prior_claim_id": "gartner-hype-cycle-1996-017",
  "change": "dropped",
  "subject_id": "massively-parallel-processing"
 },
 {
  "id": "gartner-hype-cycle-1996-018-renamed",
  "prior_claim_id": "gartner-hype-cycle-1996-018",
  "new_claim_id": "gartner-hype-cycle-1997-021",
  "change": "renamed",
  "subject_id": "object-oriented-programming",
  "note": "\"Object-oriented Programming\" -> \"OO Programming\""
 },
 {
  "id": "gartner-hype-cycle-1997-005-dropped",
  "prior_claim_id": "gartner-hype-cycle-1997-005",
  "change": "dropped",
  "subject_id": "dvd"
 },
 {
  "id": "gartner-hype-cycle-1997-006-renamed",
  "prior_claim_id": "gartner-hype-cycle-1997-006",
  "new_claim_id": "gartner-hype-cycle-1998-017",
  "change": "renamed",
  "subject_id": "push",
  "note": "\"Netcasting/ Push Technology\" -> \"Push\""
 },
 {
  "id": "gartner-hype-cycle-1997-007-dropped",
  "prior_claim_id": "gartner-hype-cycle-1997-007",
  "change": "dropped",
  "subject_id": "smart-cards"
 },
 {
  "id": "gartner-hype-cycle-1997-008-renamed",
  "prior_claim_id": "gartner-hype-cycle-1997-008",
  "new_claim_id": "gartner-hype-cycle-1998-015",
  "change": "renamed",
  "subject_id": "java-the-platform",
  "note": "\"Java - the Platform\" -> \"Java Platform\""
 },
 {
  "id": "gartner-hype-cycle-1997-012-renamed",
  "prior_claim_id": "gartner-hype-cycle-1997-012",
  "new_claim_id": "gartner-hype-cycle-1998-004",
  "change": "renamed",
  "subject_id": "interactive-tv",
  "note": "\"Interactive/ Web TV\" -> \"Interactive/Internet TV\""
 },
 {
  "id": "gartner-hype-cycle-1997-013-dropped",
  "prior_claim_id": "gartner-hype-cycle-1997-013",
  "change": "dropped",
  "subject_id": "virtual-reality"
 },
 {
  "id": "gartner-hype-cycle-1997-014-renamed",
  "prior_claim_id": "gartner-hype-cycle-1997-014",
  "new_claim_id": "gartner-hype-cycle-1998-021",
  "change": "renamed",
  "subject_id": "personal-digital-assistants",
  "note": "\"PDAs\" -> \"Personal Digital Assistants\""
 },
 {
  "id": "gartner-hype-cycle-1997-017-dropped",
  "prior_claim_id": "gartner-hype-cycle-1997-017",
  "change": "dropped",
  "subject_id": "application-sharing"
 },
 {
  "id": "gartner-hype-cycle-1997-018-renamed",
  "prior_claim_id": "gartner-hype-cycle-1997-018",
  "new_claim_id": "gartner-hype-cycle-1998-022",
  "change": "renamed",
  "subject_id": "data-mining",
  "note": "\"Database Mining\" -> \"Data Mining\""
 },
 {
  "id": "gartner-hype-cycle-1997-019-dropped",
  "prior_claim_id": "gartner-hype-cycle-1997-019",
  "change": "dropped",
  "subject_id": "java-the-language"
 },
 {
  "id": "gartner-hype-cycle-1997-020-dropped",
  "prior_claim_id": "gartner-hype-cycle-1997-020",
  "change": "dropped",
  "subject_id": "worldwide-web-plus-intranets"
 },
 {
  "id": "gartner-hype-cycle-1997-021-dropped",
  "prior_claim_id": "gartner-hype-cycle-1997-021",
  "change": "dropped",
  "subject_id": "object-oriented-programming"
 },
 {
  "id": "gartner-hype-cycle-1997-022-dropped",
  "prior_claim_id": "gartner-hype-cycle-1997-022",
  "change": "dropped",
  "subject_id": "workflow"
 },
 {
  "id": "gartner-hype-cycle-1997-023-dropped",
  "prior_claim_id": "gartner-hype-cycle-1997-023",
  "change": "dropped",
  "subject_id": "imaging"
 },
 {
  "id": "gartner-hype-cycle-1998-001-dropped",
  "prior_claim_id": "gartner-hype-cycle-1998-001",
  "change": "dropped",
  "subject_id": "ubiquitous-computing"
 },
 {
  "id": "gartner-hype-cycle-1998-004-dropped",
  "prior_claim_id": "gartner-hype-cycle-1998-004",
  "change": "dropped",
  "subject_id": "interactive-tv"
 },
 {
  "id": "gartner-hype-cycle-1998-005-dropped",
  "prior_claim_id": "gartner-hype-cycle-1998-005",
  "change": "dropped",
  "subject_id": "on-line-communities"
 },
 {
  "id": "gartner-hype-cycle-1998-006-dropped",
  "prior_claim_id": "gartner-hype-cycle-1998-006",
  "change": "dropped",
  "subject_id": "xdsl"
 },
 {
  "id": "gartner-hype-cycle-1998-008-renamed",
  "prior_claim_id": "gartner-hype-cycle-1998-008",
  "new_claim_id": "gartner-hype-cycle-1999-011",
  "change": "renamed",
  "subject_id": "knowledge-management",
  "note": "\"Knowledge Management\" -> \"Knowledge Mgt\""
 },
 {
  "id": "gartner-hype-cycle-1998-009-dropped",
  "prior_claim_id": "gartner-hype-cycle-1998-009",
  "change": "dropped",
  "subject_id": "extranets"
 },
 {
  "id": "gartner-hype-cycle-1998-010-dropped",
  "prior_claim_id": "gartner-hype-cycle-1998-010",
  "change": "dropped",
  "subject_id": "streaming-media-over-web"
 },
 {
  "id": "gartner-hype-cycle-1998-011-dropped",
  "prior_claim_id": "gartner-hype-cycle-1998-011",
  "change": "dropped",
  "subject_id": "ip-telephony"
 },
 {
  "id": "gartner-hype-cycle-1998-013-dropped",
  "prior_claim_id": "gartner-hype-cycle-1998-013",
  "change": "dropped",
  "subject_id": "agents"
 },
 {
  "id": "gartner-hype-cycle-1998-014-dropped",
  "prior_claim_id": "gartner-hype-cycle-1998-014",
  "change": "dropped",
  "subject_id": "vrml-avatars"
 },
 {
  "id": "gartner-hype-cycle-1998-015-dropped",
  "prior_claim_id": "gartner-hype-cycle-1998-015",
  "change": "dropped",
  "subject_id": "java-the-platform"
 },
 {
  "id": "gartner-hype-cycle-1998-016-dropped",
  "prior_claim_id": "gartner-hype-cycle-1998-016",
  "change": "dropped",
  "subject_id": "network-computers"
 },
 {
  "id": "gartner-hype-cycle-1998-017-dropped",
  "prior_claim_id": "gartner-hype-cycle-1998-017",
  "change": "dropped",
  "subject_id": "push"
 },
 {
  "id": "gartner-hype-cycle-1998-018-dropped",
  "prior_claim_id": "gartner-hype-cycle-1998-018",
  "change": "dropped",
  "subject_id": "cable-modems"
 },
 {
  "id": "gartner-hype-cycle-1998-019-dropped",
  "prior_claim_id": "gartner-hype-cycle-1998-019",
  "change": "dropped",
  "subject_id": "desktop-videoconferencing"
 },
 {
  "id": "gartner-hype-cycle-1998-021-renamed",
  "prior_claim_id": "gartner-hype-cycle-1998-021",
  "new_claim_id": "gartner-hype-cycle-1999-020",
  "change": "renamed",
  "subject_id": "personal-digital-assistants",
  "note": "\"Personal Digital Assistants\" -> \"PDAs\""
 },
 {
  "id": "gartner-hype-cycle-1998-023-dropped",
  "prior_claim_id": "gartner-hype-cycle-1998-023",
  "change": "dropped",
  "subject_id": "intranet-publishing"
 },
 {
  "id": "gartner-hype-cycle-1999-003-dropped",
  "prior_claim_id": "gartner-hype-cycle-1999-003",
  "change": "dropped",
  "subject_id": "text-mining"
 },
 {
  "id": "gartner-hype-cycle-1999-005-dropped",
  "prior_claim_id": "gartner-hype-cycle-1999-005",
  "change": "dropped",
  "subject_id": "wearable-computers"
 },
 {
  "id": "gartner-hype-cycle-1999-008-dropped",
  "prior_claim_id": "gartner-hype-cycle-1999-008",
  "change": "dropped",
  "subject_id": "linux"
 },
 {
  "id": "gartner-hype-cycle-1999-011-dropped",
  "prior_claim_id": "gartner-hype-cycle-1999-011",
  "change": "dropped",
  "subject_id": "knowledge-management"
 },
 {
  "id": "gartner-hype-cycle-1999-013-advanced",
  "prior_claim_id": "gartner-hype-cycle-1999-013",
  "new_claim_id": "gartner-hype-cycle-2000-015",
  "change": "advanced",
  "subject_id": "voip",
  "note": "time to plateau 2 to 5 years -> less than 2 years"
 },
 {
  "id": "gartner-hype-cycle-1999-014-dropped",